{
  "$schema": "https://json-schema.org/draft/2020-12/schema",
  "$id": "https://local.investment-support-agent/contracts/health.schema.json",
  "title": "Health snapshot",
  "type": "object",
  "required": ["schema_version", "run_id", "run_at", "target_id", "overall_status", "summary", "stats", "sections"],
  "additionalProperties": false,
  "properties": {
    "schema_version": { "const": "health_snapshot_v1" },
    "run_id": { "type": "string", "minLength": 1 },
    "run_at": {
      "type": "string",
      "pattern": "^\\d{4}-\\d{2}-\\d{2}T\\d{2}:\\d{2}:\\d{2}\\+\\d{2}:\\d{2}$"
    },
    "target_id": { "type": "string", "minLength": 1 },
    "overall_status": { "$ref": "#/$defs/status" },
    "summary": { "type": "string", "minLength": 1 },
    "stats": {
      "type": "object",
      "additionalProperties": {
        "type": "integer",
        "minimum": 0
      }
    },
    "sections": {
      "type": "array",
      "items": { "$ref": "#/$defs/section" }
    }
  },
  "$defs": {
    "status": {
      "type": "string",
      "enum": ["ok", "warn", "error", "info", "skipped"]
    },
    "section": {
      "type": "object",
      "required": ["section_id", "title", "checks"],
      "additionalProperties": false,
      "properties": {
        "section_id": { "type": "string", "minLength": 1 },
        "title": { "type": "string", "minLength": 1 },
        "checks": {
          "type": "array",
          "items": { "$ref": "#/$defs/check" }
        }
      }
    },
    "check": {
      "type": "object",
      "required": ["check_id", "label", "status", "message", "detail", "last_run_at"],
      "additionalProperties": false,
      "properties": {
        "check_id": { "type": "string", "minLength": 1 },
        "label": { "type": "string", "minLength": 1 },
        "status": { "$ref": "#/$defs/status" },
        "message": { "type": "string" },
        "detail": { "type": "string" },
        "last_run_at": {
          "anyOf": [
            {
              "type": "string",
              "pattern": "^\\d{4}-\\d{2}-\\d{2}T\\d{2}:\\d{2}:\\d{2}\\+\\d{2}:\\d{2}$"
            },
            { "type": "null" }
          ]
        }
      }
    }
  }
}
